{
  "schemaVersion": "1.0.0",
  "experimentId": "EX-ROS-2026-A024",
  "arm": "structured-handoff",
  "completedItem": "PRAXIS-GROUP-04",
  "baselineCommit": "8b4ffa392e93b19bf39f6672a608954c934cb815",
  "headCommit": "56d16c5abb73de6beb497c1f2349cee94b085815",
  "decisions": [
    {
      "topic": "Storage location and format of declared groups",
      "decision": "Declared groups live in .ros/work/groups.json as {\"schema\":\"praxis.work-groups/1.0.0\",\"groups\":[...]}. Each entry is exactly a planner grouping.groups entry (id, members, kind, origin, sharedContext, executionRepository, crossRepository, architectureNotes; fixed field order from PlanningJson.declaredGroupFields) plus store metadata declaredAt (the --occurred-at), declaredBy (ActorJson actor or null) and membership (array of {member, operation, occurredAt, actor}; optional when parsed, missing = []; always rendered, [] after create). Store schema stays praxis.work-groups/1.0.0. Groups are kept sorted by ordinal ID. A missing file is an empty store. Writes are temp-file-then-rename and touch nothing else.",
      "evidencePaths": [
        "src/Ros.Infrastructure/Planning/FileWorkGroupStore.fs",
        "src/Ros.Contracts/Planning/PlanningJson.fs",
        "src/Ros.Domain/Planning/GroupDeclaration.fs"
      ]
    },
    {
      "topic": "How the planner reads stored groups",
      "decision": "PlanningReadPort gained DeclaredGroups: unit -> Result<DeclaredGroup list,string>; PlanningOperations.gather merges them via GroupDeclaration.mergeInto: configured grouping.groups first, then stored groups in ID order, skipping a stored ID that the --config file also declares (configuration wins). Stored entries are parsed by the same private readDeclaredGroup that parseConfiguration uses for grouping.groups.",
      "evidencePaths": [
        "src/Ros.Application/Planning/Operations.fs",
        "src/Ros.Infrastructure/Planning/FilePlanningRepository.fs",
        "tests/Ros.Tests/WorkGroupTests.fs"
      ]
    },
    {
      "topic": "Member state resolution and refusal rules",
      "decision": "GroupDeclaration.memberStates builds Map<id, MemberState> from the backlog queue then overrides with live context (live outranks backlog because a started item keeps its queue entry). Terminal = queue status 'abandoned' or live Complete/Abandoned. Unknown = in neither. create refuses (all reasons reported, fixed order): invalid ID (regex ^GROUP-[A-Z0-9]+(-[A-Z0-9]+)+$), duplicate group ID, no members, repeated member, unknown member, terminal member, crossRepository without executionRepository.",
      "evidencePaths": [
        "src/Ros.Domain/Planning/GroupDeclaration.fs"
      ]
    },
    {
      "topic": "validate semantics for stored groups",
      "decision": "Unified ./ros validate adds WorkGroupCommands.findings (path .ros/work/groups.json): unreadable/malformed store, wrong or missing schema, duplicate IDs, invalid ID, empty members, repeated member, unknown member, cross-repository without repository, empty declaredAt. A member that became terminal after declaration is NOT a finding (PRX-GRP-042 partial completion).",
      "evidencePaths": [
        "src/Ros.Domain/Planning/GroupDeclaration.fs",
        "src/Ros.Cli/WorkGroupCommands.fs",
        "src/Ros.Cli/Program.fs"
      ]
    },
    {
      "topic": "CLI shape and exit codes",
      "decision": "ros work group create --id GROUP-ID --member ITEM [--member ITEM]* --occurred-at TIMESTAMP [--kind KIND] [--origin ORIGIN] [--shared-context TEXT]* [--execution-repository NAME] [--cross-repository] [--architecture-note TEXT]* [--dry-run] [--json] [IDENTITY]. Dispatched in Program.fs through ProvenanceCommands.withResolvedActor. Exit 2 for argument errors, 1 for domain refusal or IO error (nothing written), 0 for recorded or dry-run. --json kinds: group-created (dryRun, recorded, group, members[{id,state}]) and group-rejected (id, recorded:false, errors[]), both with schema praxis.work-groups/1.0.0. Origin defaults to human-declared.",
      "evidencePaths": [
        "src/Ros.Cli/WorkGroupCommands.fs",
        "src/Ros.Cli/Program.fs",
        "docs/cli.md"
      ]
    },
    {
      "topic": "work group show: what it reads and how it joins state",
      "decision": "WorkGroupOperations.show (port: WorkGroupPort) (planning: PlanningReadPort) plannedAt plannerVersion id reads the store via WorkGroupPort.ReadStore; unknown ID returns GroupShowOutcome.NotFound before any planning. Otherwise it runs PlanningOperations.analyze, derives member states with GroupDeclaration.memberStates input.Queue input.Live (the same queue/live the planner saw), runs Grouping.recommend and builds GroupView.tryShow store states report id, matching the planner WorkGroup by WorkGroupId.value = id. The CLI uses FilePlanningRepository.create root None None (default configuration, no --config/--observations), so the planner group with the stored ID is the stored declaration.",
      "evidencePaths": [
        "src/Ros.Application/Planning/WorkGroups.fs",
        "src/Ros.Domain/Planning/GroupView.fs",
        "src/Ros.Cli/WorkGroupCommands.fs"
      ]
    },
    {
      "topic": "Member view and progress semantics",
      "decision": "GroupMemberView = {WorkItemId; Recorded: MemberState option (None = unknown to backlog and context); Planning: GroupMember option (None = not in planning inventory); Gates: members whose planner GatedBy contains this ID}. GroupView.statusCode: 'unknown' when Planning is None, 'abandoned' when PlanningState is Abandoned, else MemberStatus.code. GroupViewProgress counts every declared member (not just the planner's filtered members) by statusCode: Total, Complete, Abandoned, InProgress, Runnable, Blocked, NotRunnable, Unknown, plus a Statement naming blocked/abandoned/unknown IDs. Blocked = members with statusCode 'blocked' and their Gates. Abandoned is kept apart from complete (the planner's own GroupProgress counts abandoned as complete).",
      "evidencePaths": [
        "src/Ros.Domain/Planning/GroupView.fs",
        "tests/Ros.Tests/WorkGroupTests.fs"
      ]
    },
    {
      "topic": "work group show CLI shape and exit codes",
      "decision": "ros work group show GROUP-ID [--json]; read-only so it is dispatched in Program.fs without ProvenanceCommands.withResolvedActor (next to 'work group create'). Exit 0 shown, 1 unknown group or read error (--json kind group-not-found with errors[]), 2 missing/extra positional argument. --json kind group-shown (schema praxis.work-groups/1.0.0): group (storedGroupNode), plannerExecutionRepository, members[{id, recordedState, recordedTerminal, planningState, status, gatedBy, gates}] (null recordedState/recordedTerminal/planningState when unknown), progress{...}, blocked[{id,gates}], notes (planner GroupNote), plannedAt, commit, branch, statement. WorkGroupCommands.usage is now createUsage + ' | ' + showUsage.",
      "evidencePaths": [
        "src/Ros.Cli/WorkGroupCommands.fs",
        "src/Ros.Cli/Program.fs",
        "src/Ros.Contracts/Planning/PlanningJson.fs",
        "docs/cli.md"
      ]
    },
    {
      "topic": "Where per-member add/remove provenance lives",
      "decision": "In the stored group entry, not in .ros/events/events.jsonl: StoredGroup.Membership is a MembershipChange list {Member; Operation: MembershipOperation; OccurredAt; Actor} appended oldest-first and never rewritten. MembershipOperation is Added ('added') | Removed ('removed'), parsed by MembershipOperation.tryParse over MembershipOperation.all. The planner ignores membership (GroupStore.declarations returns only Declaration).",
      "evidencePaths": [
        "src/Ros.Domain/Planning/GroupDeclaration.fs",
        "src/Ros.Contracts/Planning/PlanningJson.fs"
      ]
    },
    {
      "topic": "work group add semantics and refusal order",
      "decision": "GroupDeclaration.addMember store states locate addedAt addedBy groupId memberId appends the member to the END of Declaration.Members (no other declaration field changes, DeclaredAt/DeclaredBy unchanged), appends a MembershipChange Added, and replaces the group in place via GroupStore.replace. addRejections: unknown group -> only [UnknownGroup]; otherwise in order AlreadyMember, then UnknownMember/TerminalMember (shared memberRejections), then RepositoryMismatch (only checked when the item is known).",
      "evidencePaths": [
        "src/Ros.Domain/Planning/GroupDeclaration.fs",
        "tests/Ros.Tests/WorkGroupTests.fs"
      ]
    },
    {
      "topic": "Execution-repository check for add (PRX-GRP-051)",
      "decision": "Item repository = Grouping.executionLocation input id (made public; the planner's evidenceFor now calls it): grouping.executionRepositories entry (explicit) > description matching 'external repository' (UnknownExternal) > input.Repository (repository name from queue/context 'repository' field, else directory name). Group repository = declared ExecutionRepository, else the distinct locations of its current members. Cross-repository groups skip the check. An UnknownExternal item is refused by a non-cross-repository group. Mismatch message names both repositories.",
      "evidencePaths": [
        "src/Ros.Domain/Planning/Grouping.fs",
        "src/Ros.Domain/Planning/GroupDeclaration.fs"
      ]
    },
    {
      "topic": "work group add application operation",
      "decision": "WorkGroupOperations.add (port: WorkGroupPort) (planning: PlanningReadPort) plannedAt plannerVersion (request: GroupAddRequest) reads the store via port.ReadStore, runs PlanningOperations.gather (not analyze) for queue, live, repository and configuration, derives states with GroupDeclaration.memberStates input.Queue input.Live, and writes only via port.WriteStore unless DryRun. Outcomes: GroupAddOutcome.Rejected | Planned(StoredGroup, AddedMember) | Recorded(StoredGroup, AddedMember); AddedMember = {Change; State; ExecutionRepository}.",
      "evidencePaths": [
        "src/Ros.Application/Planning/WorkGroups.fs"
      ]